{
  "brand": "Vallejo",
  "range": "Game Color",
  "rangeCode": "GC",
  "source": {
    "type": "pdf",
    "url": "https://www.vallejoacrylics.com/wp-content/uploads/2023/09/CC266-Game_Color-NewIC-Rev01-1.pdf",
    "extractedAt": "2026-05-27",
    "notes": "CC266 Rev.01. Includes standard GC, Metallics, Fluorescents, Xpress Color (names only — hex unavailable from PDF raster swatches), Washes (73.2xx), and Special FX (72.6xx)."
  },
  "paints": [
    {
      "code": "72.001",
      "name": "Dead White",
      "hex": "#ffffff",
      "type": "standard",
      "finish": "matte",
      "transparency": "opaque"
    },
    {
      "code": "72.003",
      "name": "Pale Flesh",
      "hex": "#c29d7e",
      "type": "standard",
      "finish": "matte",
      "transparency": "opaque"
    },
    {
      "code": "72.004",
      "name": "Elf Skin Tone",
      "hex": "#c5885b",
      "type": "standard",
      "finish": "matte",
      "transparency": "opaque"
    },
    {
      "code": "72.005",
      "name": "Moon Yellow",
      "hex": "#ecb523",
      "type": "standard",
      "finish": "matte",
      "transparency": "opaque"
    },
    {
      "code": "72.006",
      "name": "Sun Yellow",
      "hex": "#f9a222",
      "type": "standard",
      "finish": "matte",
      "transparency": "opaque"
    },
    {
      "code": "72.007",
      "name": "Gold Yellow",
      "hex": "#d6792c",
      "type": "standard",
      "finish": "matte",
      "transparency": "opaque"
    },
    {
      "code": "72.008",
      "name": "Orange Fire",
      "hex": "#f1652a",
      "type": "standard",
      "finish": "matte",
      "transparency": "opaque"
    },
    {
      "code": "72.009",
      "name": "Hot Orange",
      "hex": "#e9462e",
      "type": "standard",
      "finish": "matte",
      "transparency": "opaque"
    },
    {
      "code": "72.010",
      "name": "Bloody Red",
      "hex": "#d8282a",
      "type": "standard",
      "finish": "matte",
      "transparency": "opaque"
    },
    {
      "code": "72.011",
      "name": "Gory Red",
      "hex": "#7a1e25",
      "type": "standard",
      "finish": "matte",
      "transparency": "opaque"
    },
    {
      "code": "72.012",
      "name": "Scarlet Red",
      "hex": "#721c22",
      "type": "standard",
      "finish": "matte",
      "transparency": "opaque"
    },
    {
      "code": "72.013",
      "name": "Squid Pink",
      "hex": "#c277a3",
      "type": "standard",
      "finish": "matte",
      "transparency": "opaque"
    },
    {
      "code": "72.014",
      "name": "Warlord Purple",
      "hex": "#832758",
      "type": "standard",
      "finish": "matte",
      "transparency": "opaque"
    },
    {
      "code": "72.015",
      "name": "Hexed Lichen",
      "hex": "#4b295a",
      "type": "standard",
      "finish": "matte",
      "transparency": "opaque"
    },
    {
      "code": "72.016",
      "name": "Royal Purple",
      "hex": "#271d38",
      "type": "standard",
      "finish": "matte",
      "transparency": "opaque"
    },
    {
      "code": "72.019",
      "name": "Night Blue",
      "hex": "#131e30",
      "type": "standard",
      "finish": "matte",
      "transparency": "opaque"
    },
    {
      "code": "72.020",
      "name": "Imperial Blue",
      "hex": "#1e2b4a",
      "type": "standard",
      "finish": "matte",
      "transparency": "opaque"
    },
    {
      "code": "72.021",
      "name": "Magic Blue",
      "hex": "#0071ab",
      "type": "standard",
      "finish": "matte",
      "transparency": "opaque"
    },
    {
      "code": "72.022",
      "name": "Ultramarine Blue",
      "hex": "#35416e",
      "type": "standard",
      "finish": "matte",
      "transparency": "opaque"
    },
    {
      "code": "72.023",
      "name": "Electric Blue",
      "hex": "#439ab0",
      "type": "standard",
      "finish": "matte",
      "transparency": "opaque"
    },
    {
      "code": "72.024",
      "name": "Turquoise",
      "hex": "#036666",
      "type": "standard",
      "finish": "matte",
      "transparency": "opaque"
    },
    {
      "code": "72.025",
      "name": "Foul Green",
      "hex": "#00aa87",
      "type": "standard",
      "finish": "matte",
      "transparency": "opaque"
    },
    {
      "code": "72.026",
      "name": "Jade Green",
      "hex": "#00795d",
      "type": "standard",
      "finish": "matte",
      "transparency": "opaque"
    },
    {
      "code": "72.027",
      "name": "Scurvy Green",
      "hex": "#154f45",
      "type": "standard",
      "finish": "matte",
      "transparency": "opaque"
    },
    {
      "code": "72.028",
      "name": "Dark Green",
      "hex": "#123323",
      "type": "standard",
      "finish": "matte",
      "transparency": "opaque"
    },
    {
      "code": "72.029",
      "name": "Sick Green",
      "hex": "#3f633d",
      "type": "standard",
      "finish": "matte",
      "transparency": "opaque"
    },
    {
      "code": "72.030",
      "name": "Goblin Green",
      "hex": "#546239",
      "type": "standard",
      "finish": "matte",
      "transparency": "opaque"
    },
    {
      "code": "72.031",
      "name": "Camouflage Green",
      "hex": "#897a3f",
      "type": "standard",
      "finish": "matte",
      "transparency": "opaque"
    },
    {
      "code": "72.032",
      "name": "Scorpy Green",
      "hex": "#528843",
      "type": "standard",
      "finish": "matte",
      "transparency": "opaque"
    },
    {
      "code": "72.034",
      "name": "Bone White",
      "hex": "#b69f76",
      "type": "standard",
      "finish": "matte",
      "transparency": "opaque"
    },
    {
      "code": "72.035",
      "name": "Dead Flesh",
      "hex": "#bba658",
      "type": "standard",
      "finish": "matte",
      "transparency": "opaque"
    },
    {
      "code": "72.036",
      "name": "Bronze Brown",
      "hex": "#af6d32",
      "type": "standard",
      "finish": "matte",
      "transparency": "opaque"
    },
    {
      "code": "72.038",
      "name": "Scrofulous Brown",
      "hex": "#a06828",
      "type": "standard",
      "finish": "matte",
      "transparency": "opaque"
    },
    {
      "code": "72.039",
      "name": "Plague Brown",
      "hex": "#a7743d",
      "type": "standard",
      "finish": "matte",
      "transparency": "opaque"
    },
    {
      "code": "72.040",
      "name": "Leather Brown",
      "hex": "#896033",
      "type": "standard",
      "finish": "matte",
      "transparency": "opaque"
    },
    {
      "code": "72.042",
      "name": "Parasite Brown",
      "hex": "#9c5e29",
      "type": "standard",
      "finish": "matte",
      "transparency": "opaque"
    },
    {
      "code": "72.043",
      "name": "Beasty Brown",
      "hex": "#745229",
      "type": "standard",
      "finish": "matte",
      "transparency": "opaque"
    },
    {
      "code": "72.044",
      "name": "Dark Fleshtone",
      "hex": "#583529",
      "type": "standard",
      "finish": "matte",
      "transparency": "opaque"
    },
    {
      "code": "72.045",
      "name": "Charred Brown",
      "hex": "#3b2726",
      "type": "standard",
      "finish": "matte",
      "transparency": "opaque"
    },
    {
      "code": "72.047",
      "name": "Wolf Grey",
      "hex": "#b7cac9",
      "type": "standard",
      "finish": "matte",
      "transparency": "opaque"
    },
    {
      "code": "72.048",
      "name": "Sombre Grey",
      "hex": "#54646f",
      "type": "standard",
      "finish": "matte",
      "transparency": "opaque"
    },
    {
      "code": "72.049",
      "name": "Stonewall Grey",
      "hex": "#959083",
      "type": "standard",
      "finish": "matte",
      "transparency": "opaque"
    },
    {
      "code": "72.050",
      "name": "Neutral Grey",
      "hex": "#6c6e66",
      "type": "standard",
      "finish": "matte",
      "transparency": "opaque"
    },
    {
      "code": "72.051",
      "name": "Black",
      "hex": "#000000",
      "type": "standard",
      "finish": "matte",
      "transparency": "opaque"
    },
    {
      "code": "72.052",
      "name": "Silver",
      "hex": "#a9b2b4",
      "type": "metallic",
      "finish": "metallic",
      "transparency": "opaque"
    },
    {
      "code": "72.053",
      "name": "Chainmail",
      "hex": "#8a939a",
      "type": "metallic",
      "finish": "metallic",
      "transparency": "opaque"
    },
    {
      "code": "72.054",
      "name": "Dark Gunmetal",
      "hex": "#696d72",
      "type": "metallic",
      "finish": "metallic",
      "transparency": "opaque"
    },
    {
      "code": "72.055",
      "name": "Polished Gold",
      "hex": "#e1b132",
      "type": "metallic",
      "finish": "metallic",
      "transparency": "opaque"
    },
    {
      "code": "72.056",
      "name": "Glorious Gold",
      "hex": "#cf8b33",
      "type": "metallic",
      "finish": "metallic",
      "transparency": "opaque"
    },
    {
      "code": "72.057",
      "name": "Bright Bronze",
      "hex": "#9e5917",
      "type": "metallic",
      "finish": "metallic",
      "transparency": "opaque"
    },
    {
      "code": "72.058",
      "name": "Brassy Brass",
      "hex": "#aa6a46",
      "type": "metallic",
      "finish": "metallic",
      "transparency": "opaque"
    },
    {
      "code": "72.059",
      "name": "Hammered Copper",
      "hex": "#714632",
      "type": "metallic",
      "finish": "metallic",
      "transparency": "opaque"
    },
    {
      "code": "72.060",
      "name": "Tinny Tin",
      "hex": "#512b26",
      "type": "metallic",
      "finish": "metallic",
      "transparency": "opaque"
    },
    {
      "code": "72.061",
      "name": "Khaki",
      "hex": "#957c54",
      "type": "standard",
      "finish": "matte",
      "transparency": "opaque"
    },
    {
      "code": "72.062",
      "name": "Earth",
      "hex": "#705735",
      "type": "standard",
      "finish": "matte",
      "transparency": "opaque"
    },
    {
      "code": "72.063",